<?xml version="1.0" encoding="UTF-8" standalone="yes"?>
<drones xmlns:xsi="http://www.w3.org/2001/XMLSchema-instance" xsi:noNamespaceSchemaLocation="drones.xsd">
    <drone>
        <droneName>AeroFalcon-X1</droneName>
        <batteryCapacity>5200</batteryCapacity>
        <price>1475.2</price>
        <droneNew>true</droneNew>
        <framsShape>X</framsShape>
        <isAutonomus>true</isAutonomus>
        <lastUpdateDate>2026-01-01T10:00:00</lastUpdateDate>
        <managerName></managerName>
    </drone>
    <drone>
        <droneName>SkyRanger-A2</droneName>
        <batteryCapacity>6100</batteryCapacity>
        <price>1320.5</price>
        <droneNew>true</droneNew>
        <framsShape>O</framsShape>
        <isAutonomus>false</isAutonomus>
        <lastUpdateDate>2026-01-02T10:00:00</lastUpdateDate>
        <managerName></managerName>
    </drone>
    <drone>
        <droneName>StormWing-B3</droneName>
        <batteryCapacity>5800</batteryCapacity>
        <price>1589.99</price>
        <droneNew>true</droneNew>
        <framsShape>H</framsShape>
        <isAutonomus>true</isAutonomus>
        <lastUpdateDate>2026-01-03T10:00:00</lastUpdateDate>
        <managerName></managerName>
    </drone>
    <drone>
        <droneName>IronFalcon-C4</droneName>
        <batteryCapacity>7000</batteryCapacity>
        <price>2199.0</price>
        <droneNew>false</droneNew>
        <framsShape>H</framsShape>
        <isAutonomus>false</isAutonomus>
        <lastUpdateDate>2026-01-04T10:00:00</lastUpdateDate>
        <managerName></managerName>
    </drone>
    <drone>
        <droneName>NightHawk-D5</droneName>
        <batteryCapacity>6400</batteryCapacity>
        <price>1749.95</price>
        <droneNew>true</droneNew>
        <framsShape>X</framsShape>
        <isAutonomus>true</isAutonomus>
        <lastUpdateDate>2026-01-05T10:00:00</lastUpdateDate>
        <managerName></managerName>
    </drone>
    <drone>
        <droneName>SkyHunter-E6</droneName>
        <batteryCapacity>5900</batteryCapacity>
        <price>1399.75</price>
        <droneNew>true</droneNew>
        <framsShape>X</framsShape>
        <isAutonomus>false</isAutonomus>
        <lastUpdateDate>2026-01-06T10:00:00</lastUpdateDate>
        <managerName></managerName>
    </drone>
    <drone>
        <droneName>AtlasWing-F7</droneName>
        <batteryCapacity>7200</batteryCapacity>
        <price>2450.0</price>
        <droneNew>true</droneNew>
        <framsShape>O</framsShape>
        <isAutonomus>true</isAutonomus>
        <lastUpdateDate>2026-01-07T10:00:00</lastUpdateDate>
        <managerName></managerName>
    </drone>
    <drone>
        <droneName>PhantomScout-G8</droneName>
        <batteryCapacity>5600</batteryCapacity>
        <price>1250.3</price>
        <droneNew>true</droneNew>
        <framsShape>L</framsShape>
        <isAutonomus>false</isAutonomus>
        <lastUpdateDate>2026-01-08T10:00:00</lastUpdateDate>
        <managerName></managerName>
    </drone>
    <drone>
        <droneName>ThunderEye-H9</droneName>
        <batteryCapacity>6800</batteryCapacity>
        <price>1899.49</price>
        <droneNew>true</droneNew>
        <framsShape>X</framsShape>
        <isAutonomus>true</isAutonomus>
        <lastUpdateDate>2026-01-09T10:00:00</lastUpdateDate>
        <managerName></managerName>
    </drone>
    <drone>
        <droneName>VectorFalcon-I10</droneName>
        <batteryCapacity>6100</batteryCapacity>
        <price>1675.0</price>
        <droneNew>false</droneNew>
        <framsShape>H</framsShape>
        <isAutonomus>false</isAutonomus>
        <lastUpdateDate>2026-01-10T10:00:00</lastUpdateDate>
        <managerName></managerName>
    </drone>
    <drone>
        <droneName>SkyNomad-11</droneName>
        <batteryCapacity>6000</batteryCapacity>
        <price>1510.6</price>
        <droneNew>true</droneNew>
        <framsShape>X</framsShape>
        <isAutonomus>true</isAutonomus>
        <lastUpdateDate>2026-01-11T10:00:00</lastUpdateDate>
        <managerName></managerName>
    </drone>
    <drone>
        <droneName>IronScout-12</droneName>
        <batteryCapacity>6300</batteryCapacity>
        <price>1620.85</price>
        <droneNew>true</droneNew>
        <framsShape>O</framsShape>
        <isAutonomus>false</isAutonomus>
        <lastUpdateDate>2026-01-12T10:00:00</lastUpdateDate>
        <managerName></managerName>
    </drone>
    <drone>
        <droneName>NovaWing-13</droneName>
        <batteryCapacity>5700</batteryCapacity>
        <price>1349.99</price>
        <droneNew>true</droneNew>
        <framsShape>H</framsShape>
        <isAutonomus>true</isAutonomus>
        <lastUpdateDate>2026-01-13T10:00:00</lastUpdateDate>
        <managerName></managerName>
    </drone>
    <drone>
        <droneName>HyperFalcon-98</droneName>
        <batteryCapacity>6900</batteryCapacity>
        <price>2099.0</price>
        <droneNew>true</droneNew>
        <framsShape>X</framsShape>
        <isAutonomus>true</isAutonomus>
        <lastUpdateDate>2026-04-08T10:00:00</lastUpdateDate>
        <managerName></managerName>
    </drone>
    <drone>
        <droneName>QuantumEye-99</droneName>
        <batteryCapacity>7100</batteryCapacity>
        <price>2375.5</price>
        <droneNew>false</droneNew>
        <framsShape>X</framsShape>
        <isAutonomus>false</isAutonomus>
        <lastUpdateDate>2026-04-09T10:00:00</lastUpdateDate>
        <managerName></managerName>
    </drone>
    <drone>
        <droneName>SkyTitan-100</droneName>
        <batteryCapacity>7500</batteryCapacity>
        <price>2799.99</price>
        <droneNew>true</droneNew>
        <framsShape>L</framsShape>
        <isAutonomus>true</isAutonomus>
        <lastUpdateDate>2026-04-10T10:00:00</lastUpdateDate>
        <managerName></managerName>
    </drone>
</drones>
